{
  "version": "1.0",
  "description": "Multi-contract deployment manifest for Token, NFT, and Governance ecosystem",
  "contracts": [
    {
      "name": "TokenContract",
      "sourcePath": "../../src/TokenContract/TokenContract.cs",
      "dependencies": [],
      "generateDebugInfo": true,
      "optimize": true,
      "gasLimit": 100000000,
      "initialParameters": ["@deployer"],
      "postDeploymentActions": [],
      "updateConfiguration": {
        "allowUpdates": true,
        "requireOwnerAuthorization": true,
        "updateGasLimit": 50000000
      }
    },
    {
      "name": "NFTContract", 
      "sourcePath": "../../src/NFTContract/NFTContract.cs",
      "dependencies": ["TokenContract"],
      "generateDebugInfo": true,
      "optimize": true,
      "gasLimit": 100000000,
      "initialParameters": ["@deployer", "@TokenContract", 1000000000],
      "injectDependencies": true,
      "postDeploymentActions": [],
      "updateConfiguration": {
        "allowUpdates": true,
        "requireOwnerAuthorization": true,
        "updateGasLimit": 50000000
      }
    },
    {
      "name": "GovernanceContract",
      "sourcePath": "../../src/GovernanceContract/GovernanceContract.cs", 
      "dependencies": ["TokenContract"],
      "generateDebugInfo": true,
      "optimize": true,
      "gasLimit": 100000000,
      "initialParameters": ["@deployer", "@TokenContract"],
      "injectDependencies": true,
      "postDeploymentActions": [
        {
          "method": "createProposal",
          "parameters": [1, "@NFTContract", "Add NFT contract to governance"],
          "required": false
        }
      ],
      "updateConfiguration": {
        "allowUpdates": true,
        "requireOwnerAuthorization": true,
        "requireCouncilApproval": true,
        "updateGasLimit": 50000000
      }
    }
  ],
  "deploymentOrder": ["TokenContract", "NFTContract", "GovernanceContract"],
  "networkOverrides": {
    "testnet": {
      "gasPrice": 200000000,
      "validUntilBlockOffset": 200
    },
    "mainnet": {
      "gasPrice": 500000000,
      "validUntilBlockOffset": 500,
      "requireConfirmation": true
    }
  }
}